{
  "schema_version": "1.0.0",
  "task_id": "2a.5",
  "iter": 1,
  "codex_session_id": "pre_bootstrap_backfill_1777737479",
  "model": "gpt-5.5",
  "reasoning_effort": "xhigh",
  "canonical_pin_sha": "a21acabba793d7a5d6b50942cd59c732a7aff9429ad99e2995ef202488e4f3a1",
  "commit_sha": "0000000000000000000000000000000000000000",
  "diff_sha256": "5bd203d46d1268f565c4d3b4f1b8c44dbd452a42d49cc69d48d87fd03f6d1239",
  "verdict": "APPROVE",
  "verdict_reason": "Pre-bootstrap backfill for task 2A.5 (F9 two-family disagreement). Task completed BEFORE Plan v13 §C gate became operational. This verdict is HUMAN-ATTESTED via the substrate evidence listed in manifest_evidence; it is NOT a Codex-generated verdict and does not satisfy the §C-server CI re-validation requirement. The §C-server CI gate will not fire on these tasks because no commit triggers it; these tasks pre-date the gate. Future commits to these task scopes WILL be gated normally.",
  "findings": [],
  "manifest_evidence": [
    "web/app/inspector/[runId]/page.tsx"
  ],
  "rationale": "Top KPI card with PASS/FAIL styling + destructive banner. Crown-jewel C5 satisfied.",
  "timestamp": "2026-05-02T15:57:59Z",
  "hmac_sha256": "5972f313d49677110d3ce56a6ef7b58ffbb33f001a456685c4c595bde2455296"
}